book_id,title,author,translated_title,translated_author,search_text
11583,einführung in die rhetorische textanalyse,Heinrich F. Plett,수사적 텍스트 분석 입문,하인리히 F. 플레트,Dieses Fachbuch bietet eine wissenschaftliche Einführung in die rhetorische Textanalyse und richtet sich an Studierende der Sprachwissenschaft. 이 전문 서적은 언어학 전공자를 위해 수사적 텍스트 분석에 대한 학술적 입문을 제시합니다.
11584,Montague-Grammatik - Eine Einführung mit Anwendungen auf das Deutsche,Max Niemeyer Verlag,몬티규 문법: 독일어 응용을 통한 입문서,맥스 니메이어 출판사,Dieses Werk von Max Niemeyer Verlag bietet eine Einführung in die Montague-Grammatik und wendet diese auf das Deutsche an. Es richtet sich an Studierende der Sprachwissenschaft. 맥스 니메이어 출판사의 이 책은 몬티규 문법을 소개하고 독일어에 이를 적용합니다. 언어학을 공부하는 학생들을 위한 교재입니다.
11585,Goethe Werke - Vermischt Schriften Sechster Band,요한 볼프강 폰 괴테,괴테 전집 - 잡동사니 제6권,요한 볼프강 폰 괴테,"Dieser Band enthält miscellaneous writings von Johann Wolfgang von Goethe, einem der bedeutendsten deutschen Dichter. Er deckt wahrscheinlich verschiedene literarische Genres und Themen ab. 이 책은 독일 문학의 거장 요한 볼프강 폰 괴테의 산문 및 기타 문헌을 포함합니다. 다양한 장르와 주제를 다룰 가능성이 높습니다."
11586,Goethe Werke - Faust I und Ⅱ Wahlverwandtschaften Dritter Band,요한 볼프강 폰 괴테,파우스트,,  한국어 정식 제목은 '파우스트'이다.
11587,Goethe Werke - Dichtung und Wahrheit Fünfter Band,요한 볼프강 폰 괴테,고테 작품 - 시와 진리 제5권,요한 볼프강 폰 괴테,"Goethes autobiographisches Hauptwerk 'Dichtung und Wahrheit', Band 5. Enthält literarische Reflexionen und Erinnerungen aus der deutschen Aufklärung und Klassik. 고테의 자서전적 대작 '시와 진리' 제5권. 독일 계몽기와 고전주의 시기의 문학적 성찰과 회상을 담고 있다."
11588,Goethe Werke - Dramen · Novellen Zweiter Band,요한 볼프강 폰 괴테, 괴테 작품집 - 극작품 · 소설 제2권,요한 볼프강 폰 괴테,"Dieser Band enthält Dramen und Novellen von Johann Wolfgang von Goethe, einem der bedeutendsten Autoren der deutschen Literaturgeschichte, und bietet Einblicke in seine künstlerische Vielfalt. 이 권에는 독일 문학사에서 가장 중요한 작가 중 한 명인 요한 볼프강 폰 괴테의 극작품과 소설들이 수록되어 있으며, 그의 예술적 다양성에 대한 통찰을 제공합니다."
11589,Goethe Werke - Gedichte · Versepen Erster Band,요한 볼프강 폰 괴테,고ethe 작품집 - 시 · 운문체 서사시 제1권,요한 볼프강 폰 괴테,Diese Ausgabe enthält Gedichte und Versepen von Johann Wolfgang von Goethe. Sie ist ein wichtiger Band der deutschen Literaturgeschichte des 18. und 19. Jahrhunderts. 이 판본은 요한 볼프강 폰 괴테의 시와 운문체 서사시를 담고 있습니다. 이는 18~19세기 독일 문학사에서 중요한 권입니다.
11590,Ausgewählte Werke - Band 5,"Marx, Engels",선정 작품 - 제5권,"마르크스, 엥겔스","Dieser Band enthält ausgewählte Texte von Marx und Engels und gehört zur Kategorie der politischen Literatur. Er bietet Einblicke in ihre theoretischen Werke aus dem 19. Jahrhundert. 이 권에는 마르크스와 엥겔스의 선정된 텍스트가 수록되어 있으며, 정치 문학 범주에 속합니다. 이 책은 19세기 그들의 이론적 작품에 대한 통찰을 제공합니다."
11591,Ausgewählte Werke - Band 2,"Marx, Engels",선집 제2권,"마르크스, 엥겔스","Dieser Band enthält ausgewählte Werke der marxistischen Theoretiker Karl Marx und Friedrich Engels. Die Sammlung behandelt grundlegende Texte zur klassischen Philosophie, Ökonomie und politischen Theorie. 이 권은 마르크스주의 이론가 카를 마르크스와 프리드리히 엥겔스의 선집을 수록했습니다. 이 문집은 고전 철학, 경제학 및 정치 이론에 관한 근본적인 텍스트를 다룹니다."
11592,Dürrenmatt Gespräch mit Heinz Ludwig Arnold - Friedrich Dürrenmatt erzählt über seine Jugend von seiner Malerei kritisiert die Situation des Theaters,Friedrich Dürrenmatt,,, 
11593,Dürrenmatt Gesammelte Hörspiele,Friedrich Dürrenmatt,뒤렌마트 전집 라디오극,프리드리히 뒤렌마트,"Eine Sammlung der Radiodramen von Friedrich Dürrenmatt, einem bedeutenden Schweizer Autor des 20. Jahrhunderts, die seine literarischen Werke im Genre des Hörspiels darstellt. 20세기 중요한 스위스 작가 프리드리히 뒤렌마트의 라디오극 모음집으로, 그의 문학 작품을 라디오극 장르로 소개합니다."
11594,Friedrich Dürrenmatt Komödien I,Friedrich Dürrenmatt,프리드리히 뤼렌마트 희극 1,프리드리히 뤼렌마트,"Diese Publikation präsentiert eine Auswahl der Komödien des Schweizer Autors Friedrich Dürrenmatt und gehört zum Bereich der deutschsprachigen Literatur. 이 저술은 스위스 작가 프리드리히 뤼렌마트의 희극 선집을 제시하며, 독일어 문헌 분야에 속합니다."
11595,Dürrenmatt Komödien II und Frühe Stücke,Friedrich Dürrenmatt, Düren마트 희극 II 및 초기 작품들, 프리드리히 뒤렌마트,"Eine Sammlung von Komödien und frühen Theaterstücken des Schweizer Autors Friedrich Dürrenmatt, ein wichtiges Werk der modernen deutschsprachigen Literatur. 스위스 작가 프리드리히 뒤렌마트의 희극 2부 및 초기 연극 작품 모음으로, 현대 독일어 문학의 중요한 작품입니다."
11596,Friedrich Dürrenmatt Komödien III,Friedrich Dürrenmatt,,, 
11597,DIE LEIDEN DES JUNGEN WERTHER NOVELLE,J. W. Goethe,젊은 베르테르의 슬픔,J. W. 괴테,"Dieser Roman erzählt die leidenschaftliche und tragische Geschichte des jungen Dichters Werther. Das Werk ist ein Klassiker der deutschen Literatur der Aufklärung und des Sturm und Drang. 이 소설은 젊은 시인 베르테르의 열정적이고 비극적인 이야기를 그린 독일 문학의 고전으로, 계몽주의와 폭풍과 충동 시대를 대표하는 작품입니다. 한국어 정식 제목은 '젊은 베르테르의 슬픔'이다."
11598,Max Frisch Tagebuch 1966-1971,Max Frisch,,, 
11599,Über Max Frisch Ⅱ,Walter Schmitz,,, 
11600,Der Arzl Gion,Hans Carossa,의사 기온,한스 카로사,"Eine literarische Erzählung von Hans Carossa, die wahrscheinlich im ländlichen Süddeutschland spielt und das Leben eines Arztes thematisiert. 한스 카로사의 문학 소설로, 아마도 독일 남부 시골 배경으로 의사의 삶을 다루고 있을 것입니다."
11601,IPHIGENIE AUF TAURIS TORQUATO TASSO,Johann Wolfgan Goethe,타우리스의 이피게네이아,요한 볼프강 폰 괴테,Dieses Werk von Johann Wolfgang von Goethe ist eine literarische Adaption des antiken Tragödienstoffes. Es thematisiert das Schicksal der Iphigenie auf der Insel Tauris in einem klassischen Setting. 요한 볼프강 폰 괴테의 이 작품은 고대 비극 소재를 문학적 각색한 것입니다. 이 책은 고전적인 배경에서 타우리스 섬에서 이피게네이의 운명을 다룹니다.
11602,IPHIGENIE AUF TAURIS TORQUATO TASSO,Johann Wolfgan Goethe,타우리스섬의 이피게네이아 토르콤토 타소,요한 볼프강 괴테,"Dieses Werk ist eine literarische Ausgabe von Goethes 'Iphigenie auf Tauris', hier unter dem Namen Torquato Tasso präsentiert, ein Klassiker der deutschen Literatur aus der Zeit des Sturm und Drang. 이 책은 독일 문학의 고전으로 스톰 운드 드랑 시대의 괴테의 '타우리스섬의 이피게네이아'를 토르콤토 타소라는 제목으로 제시한 문학적 판입니다."
11603,Hermann Lenz Verlassene Zimmer,Hermann Lenz,버림받은 방들,허르만 렌츠,"Ein Roman von Hermann Lenz, der in literarischer Prosa die Atmosphäre verlassener Räume einfängt und möglicherweise innere Konflikte oder Erinnerungsorte behandelt. 허르만 렌츠의 소설로, 문체적 산문으로 버려진 공간의 분위기를 포착하고 아마도 내적 갈등이나 기억의 장소를 다룬다."
11604,Deusche Literatur in der Bundesrepublik seit 1965 - Untersuchungen und Berichte,"Paul Michael Lützeler, Egon Schwarz",1965년 이후 연방공화국의 독일 문학 - 연구 및 보고서,"폴 마이클 뤼첼러, 에곤 슈바르츠",Diese Sammlung von Studien und Berichten analysiert die Entwicklung der deutschen Literatur in der Bundesrepublik Deutschland ab 1965. Das Werk bietet akademische Einblicke in zeitgenössische literarische Strömungen und kulturelle Kontexte. 이 책은 1965년 이후 서독에서 전개된 독일 문학의 흐름을 연구한 논문과 보고서들을 모은 학술서입니다. 현대 문학 경향과 역사적 맥락을 분석하여 독자에게 깊이 있는 이해를 제공합니다.
11605,Die deutsche Literatur im Dritten Reich - Themen · Traditionen · Wirkungen,"Horst Denkler, Karl Prüm","제3제국 시대의 독일 문학: 주제, 전통, 영향","호르스트 덴클러, 카를 프름","Dieses Buch thematisiert die deutsche Literatur im Nationalsozialismus, ihre zentralen Themen und literarischen Traditionen. Es analysiert die kulturellen Wirkungen dieser Epoche für den deutschen Buchmarkt und die Forschung. 이 책은 나치 독일 시대의 독일 문학, 그 핵심 주제와 문학적 전통을 다룹니다. 이 책 또한 당시의 문화적 영향과 그 시대가 독일에 끼친 영향에 대해 분석합니다."
11606,Gegenwartsliteratur und Drittes Reich - Deutsche Autoren in der Auseinandersetzung mit der Vergangenheit,Hans Wagener,현대 문학과 나치 독일 - 과거와의 마주침 속에서 독일 작가들,한스 바게너,"Dieses Werk untersucht, wie deutsche Autoren in ihrer Gegenwartsliteratur mit der Vergangenheit des Dritten Reiches auseinandersetzen. 이 책은 독일 작가들이 현대 문학에서 제3제국의 과거와 어떻게 마주치고 있는지를 살펴보는 연구서입니다."
11607,Dürrenmatt Frisch Weiss - Deutsches Drame der Gegenwart zwischen Kritik und Utopie,Manfred Durzak,"뒤렌마트, 프리시, 베이스 - 비판과 유토피아 사이의 현대 독일극",만프레트 뒤르자크,"Dieses Werk analysiert das deutsche Drama der Gegenwart von Dürrenmatt, Frisch und Weiss zwischen gesellschaftlicher Kritik und utopischen Visionen im literaturwissenschaftlichen Kontext. 이 작품은 문학적 맥락에서 비판과 유토피아적 비전 사이의 뒤렌마트, 프리시, 베이스의 현대 독일극을 분석합니다."
11608,Deutsche gegenwartsliteratur - Ausgangspositionen und aktuelle Entwicklungen,Manfred Durzak,독일 현대 문학: 출발 위치와 최신 동향,마르프리트 뒤르자크,Manfred Durzak analysiert die Ausgangspositionen und aktuellen Entwicklungen der deutschen Gegenwartsliteratur in einem wissenschaftlichen Überblick. 마르프리트 뒤르자크가 독일 현대 문학의 출발점과 최신 동향을 학술적으로 조망하는 책입니다.
11609,Zeitkritische Romane des 20. Jahrhunderts - Die Gesellschaft in der Kritik der deutschen Literatur,Hans Wagener,20세기의 사회비평 소설 - 독일 문학의 비판에서 본 사회,한스 바게너,Dieses Buch von Hans Wagener analysiert zeitkritische Romane im 20. Jahrhundert und untersucht die Rolle der deutschen Literatur bei der Gesellschaftskritik. 한스 바게너의 이 책은 20세기의 사회비평 소설을 분석하며 독일 문학의 사회 비판적 역할을 탐구한다.
11610,Kinder- und Jugend- literatur - Zur Typologie Funktion einer literarischen Gattung,Gerhard Haas,아동 및 청소년 문학 - 문학적 장르로서의 유형론과 기능,게르하트 하스,Das Werk analysiert die Typologie und Funktion von Kinder- und Jugendliteratur als literarische Gattung. Es richtet sich an Bibliothekare und Literaturwissenschaftler. 이 책은 아동 및 청소년 문학을 문학적 장르로서 유형론과 기능을 분석한다. 도서관 사서와 문학 연구자를 위한 학술 자료입니다.
11611,Die deutsche Literatur der Gegenwart - Aspekte und Tendenzen,Manfred Durzak,현재 독일 문학의 측면과 경향,마인프리츠 뒤르작,Dieses Werk von Manfred Durzak analysiert Aspekte und Tendenzen der gegenwärtigen deutschen Literatur in einem literaturwissenschaftlichen Kontext. 마인프리츠 뒤르작의 이 저작은 문학적 맥락에서 현재 독일 문학의 측면과 경향을 분석합니다.
11612,GESCHICHTE DER DEUTSCHEN LITERATUR - Die deutsche Literatur Zwischen Französischer Revolution und Restauration,Gerhard Schulz,독일 문학사 - 프랑스 대혁명과 복고시대 사이의 독일 문학,게르하르트 쉴츠,Gerhard Schulz stellt die Entwicklung der deutschen Literatur zwischen der Französischen Revolution und der Restaurationsära vor. Das Buch analysiert zentrale Werke und geistige Strömungen dieser historischen Epoche. 게르하르트 쉴츠가 프랑스 대혁명과 복고시대 사이의 독일 문학사를 소개한다. 이 책은 해당 시대의 핵심 작품들과 사조를 분석한다.
11613,GESCHICHTE DER DEUTSCHEN LITERATUR - Vom späten Mittelalter bis zum Barock,Hans Ruprich,,, 
11614,DER DEUTSCHE ROMAN - Vom Barock bis zur späten Romantik,Benno von Wiese,독일 소설: 바로크에서 후기 낭만주의까지,벤노 폰 비제,Ein literaturhistorisches Standardwerk zur Entwicklung des deutschen Romans vom Barock bis zur späten Romantik. 바로크 시대에서 후기 낭만주의까지의 독일 소설 발전을 다루는 문학사 표준 교재.
11615,DER DEUTSCHE ROMAN - Vom Realismus bis zur Gegenwart,Benno von Wiese,독일 소설: 리얼리즘에서 현재까지,벤노 폰 비제,"Ein Überblickswerk zur Geschichte des deutschen Romans vom Realismus bis zur modernen Gegenwartsliteratur, verfasst von Benno von Wiese. 벤노 폰 비제가 집필한 리얼리즘부터 현대 문학에 이르기까지 독일 소설사의 개요서를 다룬서적입니다."
11616,파우스트1,요한 볼프강 폰 괴테,파우스트 제1부,요한 볼프강 폰 괴테,"Dieses Werk ist der erste Teil von Johann Wolfgang von Gothes epochalem dramatischem Dichtergedicht. Es gehört zur deutschen Klassik und thematisiert die menschliche Sehnsucht und den Teufelspakt im frühneuzeitlichen Kontext. 이 작품은 요한 볼프강 폰 괴테의 시대를 대표하는 극시 서사시인 《파우스트》의 제1부입니다. 이 작품은 독일 고전주의 문학을 대표하며, 초기 근대적 배경에서 인간의 갈망과 악마와의 계약을 다루고 있습니다."
11617,헤르만과 도로테아 Hermann und Dorothea,요한 볼프강 폰 괴테,헤르만과 도로테아,요한 볼프강 폰 괴테,Dieses epische Gedicht von Goethe beschreibt die Liebe zwischen einem jungen Landwirt und einer Geflüchteten während der Französischen Revolution in Deutschland. 괴테의 서사시는 프랑스 혁명 시대의 독일에서 젊은 농부와 난민 여성 사이의 사랑을 다룬다.
11618,젊은 베르테르의 슬픔,요한 볼프강 폰 괴테,Die Leiden des jungen Werther,Johann Wolfgang von Goethe,"Dieser Briefroman des Dichters Johann Wolfgang von Goethe handelt von den Leidenschaften und dem tragischen Schicksal des jungen Werther in der zweiten Hälfte des 18. Jahrhunderts. 고전 독일 작가 요한 볼프강 폰 괴테의 편지소설로, 18세기 후반 젊은 베르테르의 열정과 비극적인 운명을 그린 작품입니다."
11619,파우스트 1,요한 볼프강 폰 괴테,파우스트 1,요한 볼프강 폰 괴테,"Dieses Werk ist der erste Teil von Johann Wolfgang von Gothes klassischem dramatischen Dichtungswerk über den Gelehrten Faust und seinen Pakt mit dem Teufel, setzend im frühneuzeitlichen Deutschland. 이 작품은 조반 볼프강 폰 괴테의 고전적 극시 작품인 박사 파우스트와 악마의 거래를 다룬 제1부로, 신시대의 독일 배경을 가집니다."
11620,파우스트 2,요한 볼프강 폰 괴테,파우스트 제2부,요한 볼프강 폰 괴테,"Dieses Werk gehört zur Kategorie Literatur und basiert auf der bekannten Figur Faust, einem bedeutenden Motiv der deutschen Kulturgeschichte. 이 책은 문학 장르에 속하며 독일 문화사에서 중요한 모티프인 파우스트를 소재로 하고 있습니다."
11621,파우스트 Faust,요한 볼프강 폰 괴테,파우스트,요한 볼프강 폰 괴테,"Ein klassisches Werk der deutschen Literatur über den Teufelspakt und die menschliche Existenz, historisch im Renaissancekontext angesiedelt. 문학적 고전이자 신과의 계약, 인간의 실존을 다루며, 역사적으로 르네상스 시대를 배경으로 합니다."
11622,파우스트 그는 누구인가?,요한 볼프강 폰 괴테,"Faust, wer ist er?",Johann Wolfgang von Goethe,"Eine literarische Untersuchung zur Figur des Faust im Werk von Johann Wolfgang von Goethe, mit Fokus auf historische und kulturelle Kontexte. 요한 볼프강 폰 괴테의 작품 속 파우스트 인물에 대한 문학적 연구로, 역사적·문화적 배경을 중점적으로 다룹니다."
11623,현대 독일문학 비평,李仁雄(이인웅),Korean to German,Korean to German,German Korean
11624,헤르만 헤세의 인도여행,헤르만 헤세,Hermann Hesses Indienreise,Hermann Hesse,Dieses Werk von Hermann Hesse gehört zur Kategorie der Literatur. Es thematisiert eine Reise nach Indien und reflektiert kulturelle und persönliche Erfahrungen während einer historisch relevanten Zeitperiode. 헤르만 헤세의 이 문학 작품은 인도 여행과 관련된 주제를 다룹니다. 역사적 맥락 속에서 문화적 체험과 개인의 성찰을 반영하고 있습니다.
11625,헤르만헤세 작품선1 수레바퀴 아래서 데미안,헤르만 헤세,Unter dem Rad. Demian,Hermann Hesse,"Eine deutsche Ausgabe zweier klassischer Romane von Hermann Hesse. Der Sammelband umfasst 'Unterm Rad' und 'Demian', bedeutende Werke der Moderne über Jugend, Selbstfindung und gesellschaftlichen Wandel. 헤르만 헤세의 두 고전 소설을 수록한 한국어 판입니다. 이 단행본에는 '수레바퀴 아래서'와 '데미안'이 포함되어 있으며, 현대 소설에서 청소년, 자아 발견, 사회 변화에 대한 중요한 작품들입니다."
11626,헤르만헤세 작품선2 싯다르타 인도의 이력서 동방순례,헤르만 헤세,Hermann-Hesse-Auswahl 2 Siddhartha Ein indisches Leben Die Morgenlandfahrt,Hermann Hesse,"Eine deutsche Auswahl zweier berühmter Romane von Hermann Hesse, die auf der indischen Spiritualität und der Suche nach innerem Frieden basieren. 헤르만 헤세의 두 가지 소설의 한국 번역본은 인도 영성과 평화를 추구하는 내용을 다룹니다."
11627,통역학 개론 Interpretation,정혜연,통역학 개론,정혜연,"Ein Einführungstext zur Interpretskunde, verfasst von Jeong Hye-yeon. Das Werk widmet sich den Grundlagen der Simultan- und Konsekutivdolmetschung im sprachwissenschaftlichen Kontext. 정혜연이 집필한 통역학 소개서로, 언어학적 맥락에서 동시통역과 연속통역의 기초를 다룹니다."
11628,헤르만 헤세와 동양의 지혜 '진정한 나'를 찾으려는 사람들을 위하여 HERMANN HESSE UND DIE ÖSTLICHE WEISHEIT,李仁雄 (이인웅),헤르만 헤세와 동양의 지혜: '진정한 나'를 찾는 이들을 위한 서,이인웅,Eine Studie über den Einfluss östlicher Weisheit auf Hermann Hesses Werke. Das Buch untersucht spirituelle Themen im literarischen Schaffen des Nobelpreisträgers für ein deutschsprachiges Publikum. 헤르만 헤세의 문학 작품에 미친 동양 지혜의 영향을 분석한 연구서. 노벨문학상 수상자의 문학적 성취 속에서 영적 주제를 탐구하여 한국어 독자에게 소개합니다.
11629,동방순례 Die Morgenlandfahrt,헤르만 헤세,동방순례,헤르만 헤세,"Hermann Hesses Roman über eine geistliche Pilgerfahrt und die Suche nach Sinn und Identität. 헤르만 헤세의 소설로, 영적인 순례와 의미 및 정체성 찾기를 다룬다."
11630,동방순례,헤르만 헤세,동방순례,헤르만 헤세,"Ein Roman von Hermann Hesse über die Reise nach Osten, ein literarisches Werk mit spirituellen Themen und historischem Hintergrund. 헤르만 헤세의 동방순례는 동방으로의 여행을 다루는 소설로, 영적 주제와 역사적 배경을 가진 문학 작품입니다."
11631,동방순례,헤르만 헤세,,, 
11632,꿈이 내 문을 두드릴 때,헤르만 헤세,German translation of Korean title (language=KR),German transliteration of Korean name (language=KR),German description Korean description
11633,꿈이 내 문을 두드릴 때,헤르만 헤세,German Translation of '꿈이 내 문을 두드릴 때',German Transliteration of '헤르만 헤세',German Description based on title/author/category Korean Translation of German Description
11634,크눌프 · 데미안,헤르만 헤세,Knulp · Demian,Hermann Hesse,"Diese Sammlung enthält zwei Erzählungen von Hermann Hesse über Jugend und Selbstfindung, setzen sich mit den Themen Identität und geistige Entwicklung im frühen 20. Jahrhundert auseinander. 이 컬렉션은 헤르만 헤세의 두 편의 단편소설로, 《크눌프》와 《데미안》을 통해 초기 20세기 개인의 정체성과 정신적 성장을 다루고 있습니다."
11635,Schriften zur Philosophie und Kunst,Schiller,철학과 예술에 관한 저술,실러,Dieses Werk sammelt Schriften des deutschen Dichters und Philosophen Friedrich Schiller zu Themen der Ästhetik und Kunsttheorie im Kontext der Weimarer Klassik. 이 책은 독일의 시인이자 철학자인 프리드리히 실러가 바이마르 고전주의 시기의 미학과 예술 이론에 관한 저술을 모은 작품입니다.
11636,Also sprach Zarathustra,Nietzsche,이렇게 말씀하셨자라투스트라,니체,"Ein philosophisches Werk von Nietzsche in literarischer Form, das in der zweiten Hälfte des 19. Jahrhunderts entstand und sich mit dem Übermenschen und der ewigen Wiederkunft auseinandersetzt. 니체의 철학적 산문으로, 19세기 후반에 집필되어 초인과 영원회귀 사상을 문학적 형식으로 탐구하는 작품입니다."
11637,"Aus dem Leben eines Taugenichts, und Gedichte",Joseph von Eichendorff,"무용지물의 삶, 그리고 시",요제프 폰 아이헨도르프,"Eine Sammlung romantischer Kurzprosa und Lyrik, die das Leben eines wandernden Dichters und die Natur in der deutschen Romantik widerspiegelt. 낭만주의의 산책하는 시인의 삶과 자연을 반영한 독일 낭만주의의 단편 소설과 시의 모음집입니다."
11638,Gedichte Hyperion,Friedrich Hölderlin,히페리온 시,프리드리히 홀더린,"Diese Ausgabe enthält Gedichte von Friedrich Hölderlin, einem zentralen Vertreter des deutschen Klassizismus und Frühromantizismus. Das Werk beleuchtet Themen wie Natur, Liebe und philosophische Reflexion. 이 판본은 독일 고전주의와 초기 낭만주의의 주요 작가 프리드리히 홀더린의 시를 수록하고 있다. 이 작품은 자연, 사랑 및 철학적 성찰과 같은 주제를 다루고 있다."
11639,"Maria Magdalena, Agnes Bernauer",Friedrich Hebbel,"마리아 마그달레네, 아그네스 베르나우어",프리드리히 헤벨,"Zwei historische Tragödien von Friedrich Hebbel, die die Schicksale von Maria Magdalena und Agnes Bernauer im 15. Jahrhundert in dramatischer Literatur behandeln. 15세기 마리아 마그달레네와 아그네스 베르나우어의 운명을 다룬 프리드리히 헤벨의 두 편의 역사적 비극 희곡으로, 독일 문학의 중요한 연극 작품이다."
11640,Eine Sache wie die Liebe,Hans Bender,사랑 같은 어떤 것,한스 벤더,Eine literarische Auseinandersetzung mit dem Wesen der Liebe. Das Werk von Hans Bender gehört zur deutschen Literatur und reflektiert menschliche Beziehungen. 사랑의 본질에 관한 문학적 고찰. 한스 벤더의 이 작품은 독일 문학에 속하며 인간 관계를 반영합니다.
11641,"Gedichte, Die Judenbuche",Annette von Droste-Hülshoff,"시집, 유대인 너도밤나무",안네트 폰 드로스테륄슈프,"Dieses Buch enthält Gedichte und die Erzählung Die Judenbuche von Annette von Droste-Hülshoff, ein Klassiker der deutschen Literatur aus dem 19. Jahrhundert. 이 책은 안네트 폰 드로스테륄슈프의 시집과 소설 <유대인 너도밤나무>를 수록한 19세기 독일 문학의 고전 작품입니다."
11642,"Immensee, und andere Novellen",Theodor Storm,임제ensee(임의의 호수)와 다른 단편들,테오도어 슈톰,"Diese Sammlung enthält den berühmten Roman 'Immensee' und weitere Novellen des realistischen Autors Theodor Storm, gesetzt im ländlichen Schleswig-Holstein des 19. Jahrhunderts. 이 작품집은 19세기 스레즈비히-홀슈타인 지방을 배경으로 한 리얼리즘 작가 테오도어 슈톰의 대표작 <임제ensee>와 다른 단편들을 수록하고 있습니다."
11643,"Aus meinem Leben Dichtung und Wahrheit, III. Und IV. Teil",Goethe,Korean,Korean,German Korean
11644,"Faust, Erster und zweiter Teil",Goethe,파우스트,고테,"Dieser Band fasst Johann Wolfgang von Goethes dramatisches Epos in zwei Teilen zusammen, das die Auseinandersetzung des Protagonisten mit dem Teufel im frühneuzeitlichen Deutschland schildert. 이 책은 초기 근대 독일에서 주인공이 악마와 맞서는 과정을 그린 요한 볼프강 폰 괴테의 두 편의 극적 서사시를 묶은 것입니다. 한국어 정식 제목은 '파우스트'이다."
