book_id,title,author,translated_title,translated_author,search_text
11814,Reisen in die Neue Welt - Die Erahrung Nordamerikas in deutschen Reise- und Answandererberichten des 19. Jahrhunderts,Peter J. Brenner,신세계 여행 - 19세기 독일 여행 및 이주 보고서의 북미 경험,피터 J. 브렌너,Dieses Buch untersucht die Wahrnehmung Nordamerikas anhand deutscher Reise- und Auswandererberichte aus dem 19. Jahrhundert im Genre der historischen Forschung. 이 책은 19세기 독일 여행기 및 이주자 기록을 통해 북미에 대한 인식을 역사 연구 장르로 탐구합니다.
11815,Karl Marx Friedrich Engels,"Marx, Engels",칼 마르크스 프리드리히 엥겔스,"마르크스, 엥겔스","Eine bibliographische Sammlung der Werke von Karl Marx und Friedrich Engels, einsetzend in den Sozialwissenschaften. 소셜 과학에 사용되는 카를 마르크스와 프리드리히 엥겔스의 작품 목록을 포함하는 서적"
11816,Gesamtausgebe - Ⅲ. Abteilung: Unveröffentlichte Abhandlungen Vorträge - Gedachtes,Martin Heidegger,전집 제3부: 미간행 논문 및 강연 - 사유,마르틴 하이데거,"Ein Band der Gesamtausgabe Martin Heideggers, der unveröffentlichte Abhandlungen und Vorträge enthält. Das Werk gehört zur Philosophie und behandelt das Thema des Gedachtes im Kontext der deutschsprachigen Geisteswissenschaft. 마르틴 하이데거의 전집 중 미간행 논문과 강연을 담고 있는 권입니다. 이 책은 철학 분야에 속하며, 독일어 인문학 맥락에서 '사유'를 주제로 다룹니다."
11817,ZEIT DER ZAUBERER - Das große Jahrzehnt der Philosophie 1919 - 1929,WOLFRAM EILENBERGER,마법사들의 시대 – 철학의 대 thập niên 1919-1929,볼프람 아이헨베르거,Dieses Werk von Wolfram Eilenberger beleuchtet die Philosophie des 'großen Jahrzehnts' 1919 bis 1929. Es gehört zur Kategorie der populären Geistesgeschichte. 볼프람 아이헨베르거의 이 저서는 1919년부터 1929년까지의 '위대한 십 년' 철학을 조명한다. 이 책은 대중 교양사 범주에 속한다.
11818,Der Mensch - Seine Natur und seine Stellung in der Welt,Arnold Gehlen,인간: 그의 본성과 세계에서의 지위,아놀트 게를른,"Arnold Gehlens philosophisch-anthropologische Analyse des Menschen und seiner Position in der Welt. Ein Klassiker der Geistesgeschichte, der Natur und Stellung des Menschen untersucht. 아놀트 게를른의 인간과 그의 세계적 지위에 대한 철학-인류학적 분석. 인간의 본성과 지위를 탐구하는 정신사적 고전."
11819,Was ist Gewalt? - Philosophische Untersuchung zu einem umstrittenen Begriff,Dietrich Schotte,폭력이란 무엇인가? - 논쟁적인 개념에 대한 철학적 연구,디트ריך 쇼테,Dieses philosophische Werk untersucht das umstrittene Gewaltkonzept und dessen Definition aus sozialwissenschaftlicher Perspektive. 이 철학 서적은 논쟁적인 폭력 개념과 그 정의를 사회과학적 관점에서 고찰합니다.
11820,Der Ursprung des Kunstwerkes,Martin Heidegger,예술작품의 기원,마르틴 하이데거,Ein philosophischer Essay über Kunst und Sein von Martin Heidegger. Ein wichtiger Text der modernen Philosophie zur Ästhetik und Kunsttheorie. 마르틴 하이데거의 예술과 존재에 관한 철학 에세이. 미학과 예술 이론을 다루는 현대 철학의 중요한 텍스트인 <예술작품의 기원>입니다.
11821,Theorie des kommunikativen Handelns Erster Band edition suhrkamp SV,Jürgen Habermas,의사소통 행위 이론 제1권,유르겐 하버마스,"Dieser erste Band von Jürgen Habermas' Werk behandelt die Theorie des kommunikativen Handelns und gehört zum Genre der philosophischen Sozialwissenschaft. 유르겐 하버마스의 작품 중 첫 번째 권으로, 의사소통 행위 이론을 다루며 철학적 사회과학 장르에 속합니다."
11822,Theorie des kommunikativen Handelns Zweiter Band edition suhrkamp SV,Jürgen Habermas,의사소통 행동의 이론 제2권 수르캄프 판,외르겐 하버마스,Das zweite Band des Werkes von Jürgen Habermas behandelt die Kommunikationstheorie in den Sozialwissenschaften und erschien im Suhrkamp Verlag. 외르겐 하버마스의 작품인 이 제2권은 사회과학 분야의 의사소통 이론을 다루며 수르캄프 출판사에서 발행되었습니다.
11823,Ad Carl Schmitt Gegenstrebige Fügung,Jacob Taubes,칼 슈미트에게: 대립되는 화음,야콥 타ubes,Jacob Taubes analysiert Carl Schmitts politische Theologie in diesem philosophischen Essay. Das Werk untersucht Schmitts Begriff der Politik vor dem Hintergrund der Weimarer Republik und des 20. Jahrhunderts. 야콥 타ubes는 이 철학 에세이에서 칼 슈미트의 정치 신학을 분석합니다. 이 작품은 바이마르 공화국과 20세기의 배경 속에서 슈미트의 정치 개념을 탐구합니다.
11824,Vorlesungen zur Einführung in die Psychoanalyse Und Neue Folge,Sigmund Freud,정신분석 입문 강의 및 신작 연작,지그문트 프로이트,"Sigmund Freuds Vorlesungen zur Psychoanalyse-Einführung, ein Schlüsselwerk der Psychologie und Kulturgeschichte, das Grundlagen und Entwicklungen des psychoanalytischen Denkens darlegt. 지그문트 프로이트의 정신분석학 입문 강의는 심리학과 문화사의 핵심 저술로, 정신분석적 사고의 기초와 발전 과정을 다루고 있다."
11825,Die Traumdeutung,Sigmund Freud,꿈의 해석,지그문트 프로이트,"Ein klassisches Werk der Psychoanalyse, das die Bedeutung von Träumen in der menschlichen Psyche erforscht und als grundlegendes Buch der modernen Psychologie gilt. 현대 심리학의 고전으로 꿈의 해석을 통해 무의식 세계를 탐구한 프로이트의 대표작으로, 정신분석학의 기초를 다진 중요 문헌입니다."
11826,Psychologische Schriften,Sigmund Freud,심리학 논문,지그문트 프로이트,Eine Sammlung psychologischer Schriften von Sigmund Freud im Bereich der Sozialwissenschaften. 지그문트 프로이트의 사회과학 분야 심리학 논문 모음집입니다.
11827,Psychologie des Unbewußten,Sigmund Freud,무의식의 심리학,지그문트 프로이트,"Dieses Werk von Sigmund Freud gehört zur Sozialwissenschaft und behandelt die Psychologie des Unbewußten, ein zentrales Thema der Psychoanalyse. 지그문트 프로이트의 이 저서는 무의식의 심리학을 다루는 사회과학 분야의 작품으로, 정신분석학의 핵심 주제를 탐구합니다."
11828,Hysterie und Angst,Sigmund Freud,히스테리와 불안,지그문트 프로이트,Sigmund Freuds psychologische Abhandlung behandelt die Themen Hysterie und Angst. Ein wichtiges Werk der psychoanalytischen Literaturgeschichte. 지그문트 프로이트의 심리학 논문인 『히스테리와 불안』은 히스테리와 불안의 주제를 다룹니다. 정신분석 문학사의 중요한 작품입니다.
11829,Sexualleben,Sigmund Freud,성적 생활,지그문트 프로이트,Sigmund Freuds Werk Sexualleben behandelt die psychologischen und medizinischen Grundlagen der menschlichen Sexualität im Kontext der Psychoanalyse. 지그문트 프로이트의 저서 <성적 생활>은 정신분석학적 맥락에서 인간의 성에 대한 심리학적·의학적 기초를 다룹니다.
11830,"Zwang, Paranoia und Perversion",Sigmund Freud,"강박, 편집증 및 반사회성",지그문트 프로이트,"Diese Sammlung psychologischer Essays von Sigmund Freud thematisiert Zwang, Paranoia und Perversion. Das Werk ist ein klassischer Text der Psychoanalyse aus dem frühen 20. Jahrhundert. 지그문트 프로이트의 이 심리학 에세이 모음집은 강박, 편집증 및 변태성애를 주제로 다룹니다. 이 작품은 20세기 초의 정립된 정신분석학 고전 텍스트입니다."
11831,Zwei Kinderneurosen,Sigmund Freud,이유를 알 수 없는 두 가지 신경증,지그문트 프로이트,"Sigmund Freuds psychoanalytische Fallstudien aus der Frühzeit der Psychologie, die zwei Kinderneurosen detailliert analysieren. 프로이트가 초기 심리학 시기에 두 어린이의 신경증을 상세히 분석한 정신분석적 사례 연구입니다."
11832,Fragen der Gesellschaft Ursprünge der Religion,Sigmund Freud,사회의 질문들 종교의 기원,지그문트 프로이트,Sigmund Freud untersucht in dieser sozialwissenschaftlichen Schrift die psychologischen Wurzeln von Religion und deren gesellschaftliche Funktion im Kontext des frühen 20. Jahrhunderts. 지그문트 프로이트는 이 사회과학 저술에서 초기 20세기 맥락 속에서 종교의 심리적 뿌리 및 그 사회적 기능을 탐구합니다.
11833,Bildende Kunst und Literatur,Sigmund Freud,미적 예술과 문학,지그문트 프로이트,Dieses Werk von Sigmund Freud behandelt die Beziehungen zwischen Bildender Kunst und Literatur aus psychoanalytischer Perspektive. Es ist eine zentrale Studie zur Kunstinterpretation. 지그문트 프로이트의 이 저서는 정신분석학적 관점에서 시각 예술과 문학의 관계를 탐구한다. 이 책은 예술 해석에 관한 핵심 연구로 평가된다.
11834,Schriften zur Behandlungstechnik,Sigmund Freud,치료 기법에 관한 논문,지그문트 프로이트,Diese Sammlung enthält Sigmund Freuds Schriften zur Psychoanalysetechnik. Ein Schlüsselwerk der Psychologie aus dem frühen 20. Jahrhundert. 지그문트 프로이트의 정신분석 치료 기술에 관한 논문 집입니다. 20세기 초 심리학의 고전적 저작입니다.
11835,Euphorion - Zeitschrift für Literaturgeschichte 86.Band 3.Heft,RAINER GRUENTER,유포리온: 문학사 학술지 86권 3호,라인어 그륀터,"Eine Ausgabe der Literaturzeitschrift Euphorion, herausgegeben von Rainer Grünter, die wissenschaftliche Aufsätze zur Literaturgeschichte und -forschung veröffentlicht. 라인어 그륀터가 편집한 문학 학술지 <유포리온>의 한 권으로, 문학사와 문학 연구에 관한 학술 논문들을 수록하고 있습니다."
11836,Euphorion - Zeitschrift für Literaturgeschichte 86.Band 4.Heft,RAINER GRUENTER,유포리온 - 문학사 저널 86권 4호,라이너 그뢀터,"Dieses Heft der Zeitschrift für Literaturgeschichte enthält Fachartikel zur Forschung über literarische Texte und Traditionen, herausgegeben von Rainer Grünter. 라이너 그뢀터가 편집한 이 문학사 저널 호수는 문학적 텍스트와 전통에 대한 연구 논문들을 수록하고 있습니다."
11837,Euphorion - Zeitschrift für Literaturgeschichte 87.Band 1.Heft,RAINER GRUENTER,,, 
11838,Euphorion - Zeitschrift für Literaturgeschichte 87.Band 2/3.Heft,RAINER GRUENTER,유럽리온 - 문학사 저널 87권 2/3호,라이너 그륀터,"Ein Heft der Zeitschrift Euphorion zur Literaturgeschichte, herausgegeben von Rainer Grünter, das Beiträge zur historischen Literaturwissenschaft in Band 87 enthält. 라이너 그륀터가 편집한 '유럽리온' 문학사 저널 87권 중 2/3호로, 문학사 관련 학문적 연구 논문을 수록하고 있다."
11839,Euphorion - Zeitschrift für Literaturgeschichte 87.Band 4.Heft,RAINER GRUENTER,에우포리온 - 문학사 저널 제87권 제4호,라인어 그륀터,"Ein akademisches Heft der Literaturzeitschrift Euphorion, herausgegeben von Rainer Grünter. Es enthält Fachartikel zur Literaturgeschichte, wie es für das 87. Jahrgang erwartet wird. 라이너 그륀터가 편집한 학술 문예지 <에우포리온> 제87권 제4호입니다. 문학사와 관련된 전문 논문이 수록되어 있을 것으로 예상됩니다."
11840,Euphorion - Zeitschrift für Literaturgeschichte 82.Band 3.Heft,"RAINER GRUENTER, ARTHUR HENKEL",유포리온 - 문학사를 위한 저널 제82권 제3호,"라이너 그룬터, 아서 헨켈","Dieses Buch ist ein Heft der Zeitschrift für Literaturgeschichte 'Euphorion', Band 82, Heft 3, herausgegeben von Rainer Grünter und Arthur Henkel, im Bereich Literatur. 이 책은 라이너 그룬터와 아서 헨켈이 편집한 문학 분야 학술지 '유포리온 - 문학사를 위한 저널' 제82권 제3호입니다."
11841,Euphorion - Zeitschrift für Literaturgeschichte 82.Band 4.Heft,"RAINER GRUENTER, ARTHUR HENKEL",유포리온 - 문학사 잡지 82권 4호,"라이너 그룬터, 아서 훔켈","Diese Ausgabe der Zeitschrift Euphorion widmet sich der Literaturgeschichte und enthält wissenschaftliche Beiträge von Rainer Grümter und Arthur Henkel. 유포리온 잡지 82권 4호는 문학사를 다루며, 라이너 그룬터와 아서 훔켈의 학술 논문을 수록하고 있습니다."
11842,Euphorion - Zeitschrift für Literaturgeschichte 83.Band 1.Heft,"RAINER GRUENTER, ARTHUR HENKEL",유포리온 - 문학사 학술지 83권 1호,"라이너 그륀터, 아르투어 헨켈","Eine Ausgabe der Zeitschrift für Literaturgeschichte mit wissenschaftlichen Aufsätzen zu literaturhistorischen Themen, herausgegeben von Rainer Grünter und Arthur Henkel. 라이너 그륀터와 아르투어 헨켈이 편집한 문학사 학술지 『유포리온(Euphorion)』 83권 1호로, 문학적 연구 논문들을 수록하고 있다."
11843,Euphorion - Zeitschrift für Literaturgeschichte 83.Band 2.Heft,"RAINER GRUENTER, ARTHUR HENKEL",,, 
11844,Euphorion - Zeitschrift für Literaturgeschichte 83.Band 3.Heft,"RAINER GRUENTER, ARTHUR HENKEL",어포리오논 - 문학사 지 83권 3호,"라이너 그뢴터, 아서 헨켈","Ein Heft der literaturgeschichtlichen Fachzeitschrift Euphorion, herausgegeben von Rainer Grünter und Arthur Henkel, das Beiträge zur deutschen Literatur und Kulturgeschichte enthält. 라이너 그뢴터와 아서 헨켈이 편집한 문학사 전문 학술지 <어포리오논>의 한 권으로, 독일 문학 및 문화사 관련 논문들을 수록하고 있습니다."
11845,Euphorion - Zeitschrift für Literaturgeschichte 83.Band 4.Heft,"RAINER GRUENTER, ARTHUR HENKEL",에우포리온 - 문학사 학술지 83권 4호,"라이너 그뢸렌터, 아서 헨켈","Eine Ausgabe der Fachzeitschrift Euphorion zur Literaturgeschichte, Band 83, Heft 4, herausgegeben von Rainer Grünent und Arthur Henkel. 라이너 그뢸렌터와 아서 헨켈이 편집한 문예사 전문 학술지 <에우포리온> 제83권 제4호 발간본입니다."
11846,Euphorion - Zeitschrift für Literaturgeschichte 84.Band 1.Heft,"RAINER GRUENTER, ARTHUR HENKEL",유포리온 - 문학사를 위한 저널 84권 1호,"라이너 그륀터, 아서 헨켈","Die Zeitschrift für Literaturgeschichte Euphorion präsentiert in diesem Band wissenschaftliche Aufsätze zur Literatur- und Geistesgeschichte, herausgegeben von Arthur Henkel und Rainer Grünert. 문학사 전문 학술지 유포리온(Euphorion)의 이 권에서는 아서 헨켈과 라이너 그륀터가 편집한 문학과 정신사에 관한 학술 논문들을 다룹니다."
11847,Euphorion - Zeitschrift für Literaturgeschichte 84.Band 2.Heft,"RAINER GRUENTER, ARTHUR HENKEL",에우포리온: 문학사 저널 제84권 제2호,"라이너 그뤌터, 아서 헨켈",Dieses Heft der Zeitschrift für Literaturgeschichte behandelt literaturwissenschaftliche Forschung und Beiträge zu historischen Texten. 이 문헌사 저널 호는 문학사 연구 및 역사적 텍스트에 대한 학술 기재를 다룹니다.
11848,Euphorion - Zeitschrift für Literaturgeschichte 84.Band 3.Heft,"RAINER GRUENTER, ARTHUR HENKEL",유포리온 - 문학사 저널 제84권 제3호,"라이너 그륀터, 아서 헨켈",Dieses Heft der Zeitschrift für Literaturgeschichte enthält wissenschaftliche Beiträge zur Literaturwissenschaft. 이 문학사 저널 호는 문학 연구에 관한 학술 논문을 포함합니다.
11849,EIN GEFÜHL VON FREIEREM LEBEN - DEUTSCHE DICHTER IN ITALIEN,"GUNTER E. GRIMM, URSULA BREZMAZER, WALTER ERHART",더 자유로운 삶의 느낌 - 이탈리아의 독일 시인들,"군터 E. 그림, 우르술라 브레츠마처, 발터 에르하트",Dieses Werk aus der Kategorie Geschichte untersucht die Verbindung deutscher Dichter mit Italien und deren Einfluss auf die Literatur. 역사 분야의 이 책은 독일 시인과 이탈리아의 연결고리와 그들이 문학에 미친 영향을 다룹니다.
11850,"드라마연구 2015_제46호 (통합 제24권) - 특집: 현대 드라마의 새로운 서사 전략, 일반 논문","남지수, 이성곤, 최영주, 김중효, 김향, 양세라, 허필숙","Dramenforschung 2015 Nr. 46 (Gesamt Bd. 24) - Spezial: Neue Erzählstrategien im modernen Drama, Allgemeine Aufsätze","Nam Jisoo, Lee Seonggon, Choi Yeongju, Kim Joonghyo, Kim Hyang, Yang Sera, Heo Pillsuk","Eine akademische Zeitschrift zur modernen Dramenforschung mit Schwerpunkt auf neuen Erzählstrategien und allgemeinen theoretischen Aufsätzen, herausgegeben von mehreren südkoreanischen Gelehrten im Jahr 2015. 2015년 여러 남한 학자들이 편집한 현대 드라마 연구 학술지로, 새로운 서사 전략과 일반적인 이론 논문을 다룹니다."
11851,"드라마연구 2015_제47호 (통합 제25권) - 특집논문: 위기, 에도, 희망의 드라마, 일반논문","권양현, 김승옥, 이상란, 강춘애, 이경미, 이선형, 전정옥","Dramaforschung 2015, Heft 47 (Gesamtband 25) – Specialartikel: Drama der Krise, Edo, der Hoffnung, Allgmeine Artikel","Kwon Yang-hyeon, Kim Seung-ok, Lee Sang-ran, Kang Chun-ae, Lee Kyung-mi, Lee Seon-hyeong, Jeon Jeong-ok",Eine wissenschaftliche Zeitschrift zur Dramenforschung mit Schwerpunkt auf den kulturellen Kontext Edo-Japan und aktuellen dramatischen Themen der Krise und Hoffnung. 에도 시대의 문화적 배경과 위기 및 희망이라는 현대적인 연극 주제를 중점적으로 다루는 연극학 학술지입니다.
11852,"드라마연구 2016_제48호 (통합 제26권) - 특별기고, 일반논문","귄터 헥, 김성희, 김숙현, 김정섭, 김주현, 김향, 박유희, 송선호, 이상란, 이진아, 주현식, 허필숙","dramastudien 2016_nummer 48 (gesamt band 26) - spezielle beiträge, wissenschaftliche artikel","günther heck, kim sung-hee, kim suk-hyeon, kim jeong-seop, kim ju-hyeon, kim hyang, park yu-hee, song sun-ho, lee sang-ran, lee jin-ah, ju hyun-sik, heo pil-suk","Eine sammlung wissenschaftlicher artikel zur dramaforschung aus dem jahr 2016, inklusive spezieller beiträge und allgemeiner studien. 2016 년 출간된 연극 연구 관련 학술 논문 집으로, 특별 기고문과 일반 연구 논문을 포함한다."
11853,"드라마연구 2016_제49호 (통합 제27권) - 특집: 경계 없는 예술, 일반 논문","조엘 앤더슨, 리우 양, 임인자, 김병길, 박우성, 이신영, 이인순, 주현식","Dramaforschung 2016_Heft 49 (Kumulatives Heft 27) - Sonderheft: Grenzenlose Kunst, Allgemeine Aufsätze","Joel Anderson, Liu Yang, Lim In-ja, Kim Byung-gil, Park Woo-sung, Lee Shin-young, Lee In-soon, Joo Hyun-sik","Diese Zeitschrift veröffentlicht Forschungsergebnisse zum Theater mit Schwerpunkt auf zeitgenössische und traditionelle Kunst in Korea, inklusive theoretischer Essays und Fallstudien. 이 학술지에서는 현대와 전통 한국 연극에 대한 연구 결과를 출판하며, 이론적 논문과 사례 연구를 포함하고 있습니다."
11854,드라마연구 2016_제50호 (통합 제28권),"김방옥, 이재민, 이진아, 임보람, 정효숙, 최배은",독일 문학 연구 2016 제50호 (통합 제28권),"김방옥, 이재민, 이진아, 임보람, 정효숙, 최배은","Eine akademische Ausgabe über deutsche Literatur und Kultur aus dem Jahr 2016, die Forschungsergebnisse für Bibliotheksbenutzer zusammenfasst. 2016년 발행된 독일 문학 및 문화에 관한 학술 간행물로, 도서관 이용자를 위한 연구 결과를 종합한다."
11855,KONRAD ADENAUER STIFTUNG - Vergleichende Studien zum Naturalismus in Deutschland und in Korea,Kyu-Hwa Chung,독일과 한국의 자연주의에 관한 비교 연구,chung kyuhwa,Ein wissenschaftlicher Band der Konrad-Adenauer-Stiftung zu vergleichenden Studien über den Naturalismus in der Literatur von Deutschland und Korea. 콘라트 아데나워 재단이 발간한 독일과 한국 문학의 자연주의를 비교 분석한 학술서입니다.
11856,Europäische Hochschulschriften - Don Sylvio und Anselmus - Untersuchung zur Gestaltung des Wunderbaren bei C.M. Wieland und E.T.A. Hoffmann,Jeong-Taeg Lim,유러피언 학술논문 - 돈 실비오와 안셀무스 - C.M. 비엘란드와 E.T.A. 호프만의 초자연적 설정에 대한 연구,정대 임,Diese Arbeit analysiert die Darstellung des Wunderbaren in den Werken von Christoph Martin Wieland und E.T.A. Hoffmann. Es handelt sich um eine wissenschaftliche Studie zur Literaturgeschichte. 이 연구는 크리스토프 마르틴 비엘란드와 E.T.A. 호프만 작품 속 초자연적 요소의 서술 방식을 분석합니다. 본서는 독일 문학사를 다루는 학술 논문입니다.
11857,Europäische Hochschulschriften - Reflexion und Desintegration - Zur Identitätskrise der Protagonisten im Werk Georg Büchners,U-Tag Yang,유럽 대학 논문 - 성찰과 해체 - 게오르크 뷔히너 작품 속 주인공들의 정체성 위기를 중심으로,양 우창,Diese Arbeit der Reihe Europäische Hochschulschriften analysiert die Identitätskrise der Protagonisten im Werk Georg Büchners unter dem Aspekt von Reflexion und Desintegration. 유럽 대학 논문 연재물 속 이 논문은 게오르크 뷔히너 작품 속 주인공들의 정체성 위기를 성찰과 해체라는 측면에서 분석한다.
11858,Studium Sprachwissenschaft Beiheft 17 - Analyse und Kritik koreanischer Schulbücher für den Deutschunterricht - Ein Beitrag zur Lehrwerkforschung,Hyung-Uk Shin,언어학 연구 부록 17 - 독일어 수업용 한국어 교재 분석 및 비판 - 교재 연구에 대한 한 기여,신형욱,"Dieses Werk analysiert und kritisiert koreanische Schulbücher für den Deutschunterricht und trägt zur Lehrwerkforschung in der Sprachwissenschaft bei. 이 책은 독일어 수업용 한국어 교재를 분석하고 비판하며, 언어학의 교재 연구에 기여합니다."
11859,ZEIT UND TEXT Bd. 1 LIT - Experimente der Selbstdarstellung - Dramaturgien des jungen Goethe (1765-1786),Woo Young Lim,시간과 텍스트 제1권 LIT - 자기 표현의 실험들 - 젊은 괴테의 드라마투르기(1765-1786),임우영,Diese Studie analysiert die frühen dramaturgischen und autobiografischen Versuche von Johann Wolfgang von Goethe im Zeitraum von 1765 bis 1786. 이 연구는 1765년부터 1786년까지 요한 볼프강 폰 괴테의 초기 드라마투르기적 및 자서전적 실험을 분석합니다.
11860,Der Diskurs der Moderne in Thomas Manns Roman 'Doktor Faustus' - Untersuchung zum Verhältnis von Künstlerbiographie und deutscher Katastrophe - Dissertation zur Erlangung des philosophischen Doktorgrades am Fachbereich Historisch-Philologische Wissenschaf,"Tschang-Zun Kim aus Seoul, Korea",파우스트,김창준,"Diese Dissertation analysiert den Diskurs der Moderne in Thomas Manns Roman 'Doktor Faustus' und untersucht das Verhältnis von Künstlerbiographie und deutscher Katastrophe. 본 논문은 토마스 만의 소설 '닥터 파우스투스'에 나타난 모더니즘 담론을 분석하고, 예술가 전기와 독일의 비극 사이의 관계를 고찰합니다. 한국어 정식 제목은 '파우스트'이다."
11861,"Franz Kafka - Darstellung und Funktion des Raumes in ,Der Prozeß´ und ,Das Schloß´",Jeong-Suk Kim,성,김정숙,Eine literaturwissenschaftliche Untersuchung zur Raumdargestellung in Franz Kafkas Romanen „Der Prozeß“ und „Das Schloß“. Das Werk analysiert die Funktion des Raums in der modernen deutschsprachigen Literatur. 프란츠 카프카의 소설 『사건』과 『성』에서의 공간 표현에 대한 문학 연구. 이 책은 현대 독일어 문학에서 공간의 기능을 분석합니다.
11862,Unifikationsbasierte Maschinelle Übersetzung mit Koreanisch als Quellsprache,Sung-Kwon Choi,한국어를 원어로 하는 통일기반 기계번역,최성권,"Dieses Werk behandelt die theoretischen Grundlagen und praktischen Anwendungen von Unifikationsalgorithmen in der Computerlinguistik, fokussiert auf maschinelle Übersetzungssysteme mit Koreanisch als Quellsprache. 이 책은 한국어 원어를 대상으로 한 통일 기반 기계번역의 이론적 배경과 자연어처리 응용을 다룹니다."
11863,Bertolt Brecht und die chinesische Philosophie,Yun-Yeop Song,베를트 브레히트와 중국 철학,송윤엽,"Eine literaturwissenschaftliche Studie, die die Beziehungen zwischen dem deutschen Dichter Bertolt Brecht und der chinesischen Philosophie im historischen Kontext untersucht. 베를트 브레히트와 중국 철학의 관계를 역사적 맥락에서 조명한 문학 연구서입니다."
11864,Die kleinen Formen des frühen Lessing - eine Untersuchung ihres Strukturzusammenhangs - Philosophische Dissertation angenommen von der Neuphilologischen Fakultät der Universität Tübingen am 8. Juli 1991,Mi-Hyun An,,, 
11865,Rilkes Poetik des ´neuen´ Sehens in den Aufzeichungen des Malte Laurids Brigge und in den Neuen Gedichten,In-Ok Paek,,, 
11866,"Valenz und Wortbildung - Dargestellt am Beispiel der verbalen Präfixbildung mit be-. ent-, er-, miß-, ver-, zer-",Gyung-Uk Kim,"가변과 파생 - 'be-', 'ent-', 'er-', 'miß-', 'ver-', 'zer-'의 동사 접두사 파생에 대한 예시",김경욱,"Eine sprachwissenschaftliche Studie zur deutschen Wortbildung und Valenz. Der Fokus liegt auf der verbalen Präfixbildung mit häufigen Partikeln wie be-, ent-, er- und ver-. 독일어 파생과 가변에 대한 언어학 연구. be-, ent-, er-, ver- 등 일반적인 접두사를 사용한 동사 접두사 파생에 초점을 맞춘다."
